Product_name,Review,Rating,Cleaned_Review,Polarity,Subjectivity,Review_Length,Sentiment
"SAMSUNG 192 L Direct Cool Single Door 1 Star Refrigerator  (Scarlet Red, RR19T21CARH/NL)",Samsung is the good product.. but little bit bad experience.. like loud sound.. sides heat.. other wise all good.. Flipkart is always sales good product.. I trust Flipkart always..,3,samsung little bit bad experience like loud sound sides heat wise always sales trust always,0.06250000000000003,0.6533333333333333,180,Positive
"SAMSUNG 192 L Direct Cool Single Door 1 Star Refrigerator  (Scarlet Red, RR19T21CARH/NL)",when i on the fridge first 4 hours very heated then it normally cool i like nice fridge,4,fridge first hours heated normally cool like fridge,0.3,0.4916666666666667,87,Positive
"SAMSUNG 192 L Direct Cool Single Door 1 Star Refrigerator  (Scarlet Red, RR19T21CARH/NL)",super,4,super,0.3333333333333333,0.6666666666666666,5,Positive
"SAMSUNG 192 L Direct Cool Single Door 1 Star Refrigerator  (Scarlet Red, RR19T21CARH/NL)",We really love it nice and cooling as well good,4,really love cooling well,0.5,0.6,47,Positive
"SAMSUNG 192 L Direct Cool Single Door 1 Star Refrigerator  (Scarlet Red, RR19T21CARH/NL)",The product is good for a small family or to be precise for a Bachelor. The tray above vegetable bin does not have any plastic border. It is just a glass with sharp borders. Can cause serious cuts if not handled properly. Rear side foot stands are quite small. Once should definitely buy a fridge stand to protect from any floor spillover. There is no coolpack although referred in product kit. No defrost tray. The water will spill out on defrosting.,3,small family precise bachelor tray vegetable bin plastic border glass sharp borders cause serious cuts handled properly rear side foot stands quite small definitely buy fridge stand protect floor spillover coolpack although referred kit defrost tray water spill defrosting,-0.07976190476190477,0.5166666666666667,451,Negative
"SAMSUNG 192 L Direct Cool Single Door 1 Star Refrigerator  (Scarlet Red, RR19T21CARH/NL)","value for moneyclean back . silent compressor. no noise.  for a small 2 or 3 persons family it is ok. drain water collected outside , placed above compressor, normally gets evaporated. colour is also good and smooth. lock could have been provided. Good product from reliable Samsung.",5,value moneyclean back silent compressor noise small persons family ok drain water collected outside placed compressor normally gets evaporated colour also smooth lock could provided reliable samsung,0.1142857142857143,0.31428571428571433,283,Positive
"SAMSUNG 192 L Direct Cool Single Door 1 Star Refrigerator  (Scarlet Red, RR19T21CARH/NL)",Awesome price and awesome work I like it,5,awesome price awesome work like,1.0,1.0,40,Positive
"Whirlpool 190 L Direct Cool Single Door 2 Star Refrigerator  (Wine Fiesta, WDE 205 CLS PLUS 2S WINE FIESTA)",Value for money good product,4,value money,0.0,0.0,28,Neutral
"Whirlpool 190 L Direct Cool Single Door 2 Star Refrigerator  (Wine Fiesta, WDE 205 CLS PLUS 2S WINE FIESTA)",Good...,4,,0.0,0.0,7,Neutral
"Whirlpool 190 L Direct Cool Single Door 2 Star Refrigerator  (Wine Fiesta, WDE 205 CLS PLUS 2S WINE FIESTA)",Quite Good . Good 4 bachelor 👏.,4,quite bachelor,0.0,0.0,31,Neutral
"Whirlpool 190 L Direct Cool Single Door 2 Star Refrigerator  (Wine Fiesta, WDE 205 CLS PLUS 2S WINE FIESTA)",It is best parchase thanks Flipkart..🙂,5,best parchase thanks,0.6,0.25,38,Positive
"Whirlpool 190 L Direct Cool Single Door 2 Star Refrigerator  (Wine Fiesta, WDE 205 CLS PLUS 2S WINE FIESTA)",Good,5,,0.0,0.0,4,Neutral
"Whirlpool 190 L Direct Cool Single Door 2 Star Refrigerator  (Wine Fiesta, WDE 205 CLS PLUS 2S WINE FIESTA)",Awesome product,5,awesome,1.0,1.0,15,Positive
"Whirlpool 190 L Direct Cool Single Door 2 Star Refrigerator  (Wine Fiesta, WDE 205 CLS PLUS 2S WINE FIESTA)",Good,5,,0.0,0.0,4,Neutral
"Whirlpool 190 L Direct Cool Single Door 2 Star Refrigerator  (Wine Fiesta, WDE 205 CLS PLUS 2S WINE FIESTA)",So nice,5,,0.0,0.0,7,Neutral
"Whirlpool 190 L Direct Cool Single Door 2 Star Refrigerator  (Wine Fiesta, WDE 205 CLS PLUS 2S WINE FIESTA)",Super product fast delivery,5,super fast delivery,0.26666666666666666,0.6333333333333333,27,Positive
"Whirlpool 190 L Direct Cool Single Door 2 Star Refrigerator  (Wine Fiesta, WDE 205 CLS PLUS 2S WINE FIESTA)",Good for small fimly 💥  Value for money and good to good,3,small fimly value money,-0.25,0.4,56,Negative
realme 80 cm (32 inch) HD Ready LED Smart Android TV  (TV 32),Item is good sound quality is good picture is good realme tv best,5,item sound quality picture realme tv best,0.7,0.35,65,Positive
realme 80 cm (32 inch) HD Ready LED Smart Android TV  (TV 32),Ertugrul Fans❤️💓This is most iconic Tv Is awesome. This tv is 43 inch Sound is very beautiful with Dolby speakersConnectivity is very fast and pictures quality is best. As much as I appreciate this tv,5,ertugrul fansthis iconic tv awesome tv inch sound beautiful dolby speakersconnectivity fast pictures quality best much appreciate tv,0.5928571428571429,0.5714285714285714,200,Positive
realme 80 cm (32 inch) HD Ready LED Smart Android TV  (TV 32),"After 1 Year of TV Usage, Awesome TV... Superb Sound & Excellent Picture Quality... We have to download Google Home App from playstore for connectivity of Phone to TV ...... Overall Best TV at this price... Thank You ❤️",5,year tv usage awesome tv superb sound excellent picture quality download google home app playstore connectivity tv overall best tv price thank,0.7333333333333334,0.6166666666666666,219,Positive
realme 80 cm (32 inch) HD Ready LED Smart Android TV  (TV 32),Nice tv in the segment.... Good to see full HD display... Youtube works perfectly... 👌... Play store is awesome... Overall 4.5/5 🌟,4,tv segment see full hd display youtube works perfectly play store awesome overall,0.5875,0.6375,130,Positive
realme 80 cm (32 inch) HD Ready LED Smart Android TV  (TV 32),"As promised by realme,Better picture, better sound, better visibility,better speed and connectivity. Better purchased if anyone of you thinking to buy an android TV this could be a wonderful choice for you as its side viewing angle is also wonderful.                  And also for your family.(better choice)",5,promised realmebetter picture better sound better visibilitybetter speed connectivity better purchased anyone thinking buy android tv could wonderful choice side viewing angle also wonderful also familybetter choice,0.65,0.65,308,Positive
realme 80 cm (32 inch) HD Ready LED Smart Android TV  (TV 32),Awesome tv yrr... Agar tmhe lena h to... Bina soche lelo.... Literally the tv is awesome ❤i love it,5,awesome tv yrr agar tmhe lena h bina soche lelo literally tv awesome love,0.8333333333333334,0.8666666666666667,99,Positive
realme 80 cm (32 inch) HD Ready LED Smart Android TV  (TV 32),So far soo good.. picture quality is amazing with respect to HD ready perspective. Sound is superb. No connectivity issue or lagging faced soo far. Nothing to complaint. But I have made a mistake by not including 3years protection while buying this TV. Wall mounted by Jeeves perfectly and charged only 400 rs. Overall a nice experience. Thanks.,5,far soo picture quality amazing respect hd ready perspective sound superb connectivity issue lagging faced soo far nothing complaint made mistake including years protection buying tv wall mounted jeeves perfectly charged rs overall experience thanks,0.33000000000000007,0.62,345,Positive
realme 80 cm (32 inch) HD Ready LED Smart Android TV  (TV 32),"This is the most iconic TV and best budget TVI'll experienced a little bit lag,overall TV is very goodPerformance is all good. The interesting part is the speakers, It is the best dolby atmos speaker I have ever seen.Overall the TV is beast.I do not have any hate on this TV. For pictures quality I'll give 4stars. It gives the best color on the TV screen. I have purchased 3years extended warranty, because in this warranty the agents will repair the TV on the door step itself,",5,iconic tv best budget tvill experienced little bit lagoverall tv goodperformance interesting part speakers best dolby atmos speaker ever seenoverall tv beasti hate tv pictures quality ill give stars gives best color tv screen purchased years extended warranty warranty agents repair tv door step,0.3680555555555556,0.5777777777777778,479,Positive
realme 80 cm (32 inch) HD Ready LED Smart Android TV  (TV 32),Budget friendly smart tv for all.Lagging issues remain. Working 3rd part app like thop tv superbly. Operating is easy. Even my 6 yrs kid can open this smart tv using wifi or normal set top box. 20% sound is enough for living room. Casting and voice assistance are slow to respond. Overall great choice for entertainment.,4,budget friendly smart tv alllagging issues remain working rd part app like thop tv superbly operating easy even yrs kid open smart tv using wifi normal set top box sound enough living room casting voice assistance slow respond overall choice entertainment,0.2489087301587302,0.547420634920635,320,Positive
realme 80 cm (32 inch) HD Ready LED Smart Android TV  (TV 32),"Don't buy this tvMy tv display has not working within 3 monthsit's not a good tv not value for moneyGo for good brands like LG,Samsung or Sony",1,dont buy tvmy tv display working within monthsits tv value moneygo brands like lgsamsung sony,0.0,0.0,142,Neutral
Vu Premium TV 80 cm (32 inch) HD Ready LED Smart TV with Bezel-Less Frame  (32UA),Very good product .Buy this product about price.,5,buy price,0.0,0.0,48,Neutral
Vu Premium TV 80 cm (32 inch) HD Ready LED Smart TV with Bezel-Less Frame  (32UA),As per price value product is UP TO THE MARK..,5,per price value mark,0.0,0.0,46,Neutral
Vu Premium TV 80 cm (32 inch) HD Ready LED Smart TV with Bezel-Less Frame  (32UA),Very nice product go for it velue for money picture quality suparb,5,go velue money picture quality suparb,0.0,0.0,66,Neutral
Vu Premium TV 80 cm (32 inch) HD Ready LED Smart TV with Bezel-Less Frame  (32UA),Super quality led don't think too much go for it 👌🤪,5,super quality led dont think much go,0.26666666666666666,0.43333333333333335,51,Positive
Vu Premium TV 80 cm (32 inch) HD Ready LED Smart TV with Bezel-Less Frame  (32UA),My suggestion not purchase this product not full android simple Android not support Disney hotsatr not buletoot connection,1,suggestion purchase full android simple android support disney hotsatr buletoot connection,0.175,0.4535714285714286,122,Positive
Vu Premium TV 80 cm (32 inch) HD Ready LED Smart TV with Bezel-Less Frame  (32UA),Good tv compare to otherd,5,tv compare otherd,0.0,0.0,25,Neutral
Vu Premium TV 80 cm (32 inch) HD Ready LED Smart TV with Bezel-Less Frame  (32UA),Value for money......,5,value money,0.0,0.0,21,Neutral
Vu Premium TV 80 cm (32 inch) HD Ready LED Smart TV with Bezel-Less Frame  (32UA),Gr8 product value for money,5,gr value money,0.0,0.0,27,Neutral
Vu Premium TV 80 cm (32 inch) HD Ready LED Smart TV with Bezel-Less Frame  (32UA),"very poor not a smart tv its semi smart tv with limited apps don,t buy",1,poor smart tv semi smart tv limited apps dont buy,-0.010714285714285725,0.5071428571428571,70,Neutral
Vu Premium TV 80 cm (32 inch) HD Ready LED Smart TV with Bezel-Less Frame  (32UA),Very nice and satisfied product,5,satisfied,0.5,1.0,31,Positive
Mi 4A Horizon Edition 100 cm (40 inch) Full HD LED Smart Android TV,Anyone who is reading my review please read completely because I have tested and analysed the TV a lot in every possible way.1. The TV really justifies its price. You cannot compare this TV's feature with high end TV of Samsung and Sony that is absurd.2. Video Quality is quite great just that when you view from an angle the intensity of colour changes which is fine concerning the price of the TV3. Sound Quality is awesome. It has 20W dual speakers which is quite great and once again don't ...,4,anyone reading review please read completely tested analysed tv lot every possible way tv really justifies price cannot compare tvs feature high end tv samsung sony absurd video quality quite view angle intensity colour changes fine concerning price tv sound quality awesome w dual speakers quite dont,0.22208333333333335,0.63,497,Positive
Mi 4A Horizon Edition 100 cm (40 inch) Full HD LED Smart Android TV,"1) Look is premium. (5/5) 2) Speakers are good and well equalled. (5/5) 3) Display is good. Prefer HD setup box. (4/5) 3) Operates faster with Bluetooth remote but slow with sensor one. 4) Pathchwall is great (Launcher).Gives modern look. (5/5) 5) Little problem with Miracast ( delay in audio), but you can use Google Home for Lagfree experience. (4/5) 6) Tv looks bezelless when it is in off mode but having small border actually. When you turn on the TV you can notice it. 7)Go for it. O...",4,look premium speakers well equalled display prefer hd setup box operates faster bluetooth remote slow sensor one pathchwall launchergives modern look little problem miracast delay audio use google home lagfree experience tv looks bezelless mode small border actually turn tv notice go,-0.10625,0.31666666666666665,493,Negative
Mi 4A Horizon Edition 100 cm (40 inch) Full HD LED Smart Android TV,This television is value for money. Bought it for 13500 during big billion days sale. It was delivered in 3 days and installation done next day. The picture quality is good and there is hardly much difference you will feel between full HD and HD ready screens. Sound is optimal . I faced a little issue while connecting my bluetooth earphones. Rest everything is good and i would definitely recommend to go for the product. Patchwall software is just great and XiaoMi have nearly perfected it in 3...,5,television value money bought big billion days sale delivered days installation done next day picture quality hardly much difference feel full hd hd ready screens sound optimal faced little issue connecting bluetooth earphones rest everything would definitely recommend go patchwall software xiaomi nearly perfected,0.11805555555555555,0.35,500,Positive
Mi 4A Horizon Edition 100 cm (40 inch) Full HD LED Smart Android TV,Best smart TV in this price segment. Though I was little bit confused about the connectivity issues written over here in the reviews before purchasing this TV but frankly speaking after using this above one month there is still no issues about the connectivity and all. Each and every functions of this TV are works very Smoothly and after the new android update it is now more faster than before. But one thing I must tell you guys that I have a home theater system with Bluetooth connectivity wh...,5,best smart tv price segment though little bit confused connectivity issues written reviews purchasing tv frankly speaking using one month still issues connectivity every functions tv works smoothly new android update faster one thing must tell guys home theater system bluetooth connectivity wh,0.15262987012987012,0.5194805194805194,500,Positive
Mi 4A Horizon Edition 100 cm (40 inch) Full HD LED Smart Android TV,"I have researched a lot before buying this TV, I almost spend a week, browsed a lot, watched 10+ hours of videos, finally within 23k, this is the TV I purchased. I was little nervous at first because all I have used is LG & Sony before, but first time I bought some non premium product. My parents couldn't even pronounce Xiomi, to be honest even I can't. After using this TV for a week, I can say, go for it. This is an awesome TV, with perfect picture quality and user interface. Yeah sound co...",5,researched lot buying tv almost spend week browsed lot watched hours videos finally within k tv purchased little nervous first used lg sony first time bought non premium parents couldnt even pronounce xiomi honest even cant using tv week say go awesome tv perfect picture quality user interface yeah sound co,0.4140625,0.6833333333333333,498,Positive
Mi 4A Horizon Edition 100 cm (40 inch) Full HD LED Smart Android TV,This is very good smart TV in budget. 40 inch is very good size neither big nor small.... I love this ..,5,smart tv budget inch size neither big small love,0.11607142857142858,0.4357142857142857,104,Positive
Mi 4A Horizon Edition 100 cm (40 inch) Full HD LED Smart Android TV,One of my friend recommended me this Mi LED TV so I bought it from flipkart and I can just say that this is the best value for money android TV from the house of Xiaomi. Picture quality is very good and even sound output is superb. Thanks to Ekart executive for super fast delivery and installation. Very happy with this purchase.,5,one friend recommended mi led tv bought say best value money android tv house xiaomi picture quality even sound output superb thanks ekart executive super fast delivery installation happy purchase,0.5619047619047619,0.5952380952380951,330,Positive
Mi 4A Horizon Edition 100 cm (40 inch) Full HD LED Smart Android TV,Best smart tv good sound I really like after using 1 Week,5,best smart tv sound really like using week,0.45357142857142857,0.38571428571428573,57,Positive
Mi 4A Horizon Edition 100 cm (40 inch) Full HD LED Smart Android TV,Very good TV nice mi,3,tv mi,0.0,0.0,20,Neutral
Mi 4A Horizon Edition 100 cm (40 inch) Full HD LED Smart Android TV,best tv in this budgetPros-- great sound- picture quality- apps Cons-While mirror casting after like 20 minutes it stopped  casting. Rest all is great,4,best tv budgetpros sound picture quality apps conswhile mirror casting like minutes stopped casting rest,0.7,0.35,150,Positive
Mi 4A Horizon Edition 80 cm (32 inch) HD Ready LED Smart Android TV,Anyone who is reading my review please read completely because I have tested and analysed the TV a lot in every possible way.1. The TV really justifies its price. You cannot compare this TV's feature with high end TV of Samsung and Sony that is absurd.2. Video Quality is quite great just that when you view from an angle the intensity of colour changes which is fine concerning the price of the TV3. Sound Quality is awesome. It has 20W dual speakers which is quite great and once again don't ...,4,anyone reading review please read completely tested analysed tv lot every possible way tv really justifies price cannot compare tvs feature high end tv samsung sony absurd video quality quite view angle intensity colour changes fine concerning price tv sound quality awesome w dual speakers quite dont,0.22208333333333335,0.63,497,Positive
Mi 4A Horizon Edition 80 cm (32 inch) HD Ready LED Smart Android TV,"1) Look is premium. (5/5) 2) Speakers are good and well equalled. (5/5) 3) Display is good. Prefer HD setup box. (4/5) 3) Operates faster with Bluetooth remote but slow with sensor one. 4) Pathchwall is great (Launcher).Gives modern look. (5/5) 5) Little problem with Miracast ( delay in audio), but you can use Google Home for Lagfree experience. (4/5) 6) Tv looks bezelless when it is in off mode but having small border actually. When you turn on the TV you can notice it. 7)Go for it. O...",4,look premium speakers well equalled display prefer hd setup box operates faster bluetooth remote slow sensor one pathchwall launchergives modern look little problem miracast delay audio use google home lagfree experience tv looks bezelless mode small border actually turn tv notice go,-0.10625,0.31666666666666665,493,Negative
Mi 4A Horizon Edition 80 cm (32 inch) HD Ready LED Smart Android TV,This television is value for money. Bought it for 13500 during big billion days sale. It was delivered in 3 days and installation done next day. The picture quality is good and there is hardly much difference you will feel between full HD and HD ready screens. Sound is optimal . I faced a little issue while connecting my bluetooth earphones. Rest everything is good and i would definitely recommend to go for the product. Patchwall software is just great and XiaoMi have nearly perfected it in 3...,5,television value money bought big billion days sale delivered days installation done next day picture quality hardly much difference feel full hd hd ready screens sound optimal faced little issue connecting bluetooth earphones rest everything would definitely recommend go patchwall software xiaomi nearly perfected,0.11805555555555555,0.35,500,Positive
Mi 4A Horizon Edition 80 cm (32 inch) HD Ready LED Smart Android TV,Best smart TV in this price segment. Though I was little bit confused about the connectivity issues written over here in the reviews before purchasing this TV but frankly speaking after using this above one month there is still no issues about the connectivity and all. Each and every functions of this TV are works very Smoothly and after the new android update it is now more faster than before. But one thing I must tell you guys that I have a home theater system with Bluetooth connectivity wh...,5,best smart tv price segment though little bit confused connectivity issues written reviews purchasing tv frankly speaking using one month still issues connectivity every functions tv works smoothly new android update faster one thing must tell guys home theater system bluetooth connectivity wh,0.15262987012987012,0.5194805194805194,500,Positive
Mi 4A Horizon Edition 80 cm (32 inch) HD Ready LED Smart Android TV,"I have researched a lot before buying this TV, I almost spend a week, browsed a lot, watched 10+ hours of videos, finally within 23k, this is the TV I purchased. I was little nervous at first because all I have used is LG & Sony before, but first time I bought some non premium product. My parents couldn't even pronounce Xiomi, to be honest even I can't. After using this TV for a week, I can say, go for it. This is an awesome TV, with perfect picture quality and user interface. Yeah sound co...",5,researched lot buying tv almost spend week browsed lot watched hours videos finally within k tv purchased little nervous first used lg sony first time bought non premium parents couldnt even pronounce xiomi honest even cant using tv week say go awesome tv perfect picture quality user interface yeah sound co,0.4140625,0.6833333333333333,498,Positive
Mi 4A Horizon Edition 80 cm (32 inch) HD Ready LED Smart Android TV,This is very good smart TV in budget. 40 inch is very good size neither big nor small.... I love this ..,5,smart tv budget inch size neither big small love,0.11607142857142858,0.4357142857142857,104,Positive
Mi 4A Horizon Edition 80 cm (32 inch) HD Ready LED Smart Android TV,One of my friend recommended me this Mi LED TV so I bought it from flipkart and I can just say that this is the best value for money android TV from the house of Xiaomi. Picture quality is very good and even sound output is superb. Thanks to Ekart executive for super fast delivery and installation. Very happy with this purchase.,5,one friend recommended mi led tv bought say best value money android tv house xiaomi picture quality even sound output superb thanks ekart executive super fast delivery installation happy purchase,0.5619047619047619,0.5952380952380951,330,Positive
Mi 4A Horizon Edition 80 cm (32 inch) HD Ready LED Smart Android TV,Best smart tv good sound I really like after using 1 Week,5,best smart tv sound really like using week,0.45357142857142857,0.38571428571428573,57,Positive
Mi 4A Horizon Edition 80 cm (32 inch) HD Ready LED Smart Android TV,Very good TV nice mi,3,tv mi,0.0,0.0,20,Neutral
Mi 4A Horizon Edition 80 cm (32 inch) HD Ready LED Smart Android TV,best tv in this budgetPros-- great sound- picture quality- apps Cons-While mirror casting after like 20 minutes it stopped  casting. Rest all is great,4,best tv budgetpros sound picture quality apps conswhile mirror casting like minutes stopped casting rest,0.7,0.35,150,Positive
SAMSUNG 80 cm (32 inch) HD Ready LED Smart TV  (UA32T4340AKXXL / UA32T4340BKXXL),Very Good Picture Quality with a decent sound system. You can surely go for this product in this price range. Good delivery by Flipkart.,5,picture quality decent sound system surely go price range delivery,0.35555555555555557,0.6518518518518518,136,Positive
SAMSUNG 80 cm (32 inch) HD Ready LED Smart TV  (UA32T4340AKXXL / UA32T4340BKXXL),Nice one at this price good Samsung 🙏🙏🙏🙏My first Samsung led tv 📺 Befor I always use lg but this time Samsung I’m happy with Samsung led tv great job by Samsung and the Flipkart Thank you 🙏 Flipkart to deliver in this lockdown also little bit late but great work by Flipkart Good luck 😉,5,one price samsung first samsung led tv befor always use lg time samsung im happy samsung led tv job samsung thank deliver lockdown also little bit late work luck,0.140625,0.6083333333333333,286,Positive
SAMSUNG 80 cm (32 inch) HD Ready LED Smart TV  (UA32T4340AKXXL / UA32T4340BKXXL),"overall is good compare to price, pictures quality is good but not hd intertnet options are also good it affordable and good",4,overall compare price pictures quality hd intertnet options also affordable,0.0,0.0,124,Neutral
SAMSUNG 80 cm (32 inch) HD Ready LED Smart TV  (UA32T4340AKXXL / UA32T4340BKXXL),"Wow!!! I am very surprised about it. It is very awesome and nice picture quality and like of Full HD but it is HD. It is Ultra HD + HDR, Deep Colour (True beautiful Colour) I am extremely happy and mind blowing. Thank Flipkart Service. I already giving rating of 5/5 🔥.Picture/Sound/Connect or all are rating of 5/5 🔥🔥🔥",5,wow surprised awesome picture quality like full hd hd ultra hd hdr deep colour true beautiful colour extremely happy mind blowing thank service already giving rating picturesoundconnect rating,0.44375,0.8125,319,Positive
