Product_name,Review,Rating,Cleaned_Review,Polarity,Subjectivity,Review_Length,Sentiment
"Xiaomi 11i 5G (Stealth Black, 128 GB)  (6 GB RAM)",Pros1 display 2 loud speaker👌👌3  good sunlight viewing4  super touch 120 Hertz5  always on display6 good looking and build7good volg mode in cameraCons1 average camera2 bulky and heavyweight3 lack of other camera feature like redmi note 10 pro4 charging speed 50 percent is very fast   But Full charge it takpercent o 60 minutes5 no EIS and OIS in camera6 only record in 1080p 30&60 fps7   4k only 30fpsOverall good phone,4,pros display loud speaker sunlight viewing super touch hertz always display looking buildgood volg mode cameracons average camera bulky heavyweight lack camera feature like redmi note pro charging speed percent fast full charge takpercent minutes eis ois camera record p fps k fpsoverall,0.16666666666666666,0.6033333333333333,421,Positive
"Xiaomi 11i 5G (Stealth Black, 128 GB)  (6 GB RAM)","Best phone for this budget,,, 1st a good battery and fast charger2nd nice camera and very good new features for vlogs3rd the dimensity 920 5g processor OMG very good4th display was awesome profomence 120Hz HDR10+Overall Very Nice Phone4.5 star out of the 5Thank you Flipkart",5,best budget st battery fast chargernd camera new features vlogsrd dimensity g processor omg goodth display awesome profomence hz hdroverall star thank,0.5840909090909091,0.5886363636363636,274,Positive
"Xiaomi 11i 5G (Stealth Black, 128 GB)  (6 GB RAM)",This phone is a perfect all rounder with some compromise s in this segment. I will prefer the 11i over the hypercharge. 11i has all the same features at lower price. Display is good and bright but i noticed Mi 11 lite feels much better and brighter some times. Battery life is too good. But camera is bit disappointed not as good as expected in this price range. Low light experience was very poor . Video quality is just ok. If you are a camera lover then this phone is not ok for you. I hope...,4,perfect rounder compromise segment prefer hypercharge features lower price display bright noticed mi lite feels much better brighter times battery life camera bit disappointed expected price range low light experience poor video quality ok camera lover ok hope,0.23500000000000001,0.6049999999999999,496,Positive
"Xiaomi 11i 5G (Stealth Black, 128 GB)  (6 GB RAM)","Good for the money I paid for 67 W varient. After using for 4 hours battery drained by 20% which is too good! Camera is very very very very poor and needs to be improved. Hopefully gets good with updates. If camera is your 1st priority then please avoid this. Go for it if you want best battery, best display, best looks and good performance!",4,money paid w varient using hours battery drained camera poor needs improved hopefully gets updates camera st priority please avoid go want best battery best display best looks performance,0.65,0.375,342,Positive
"Xiaomi 11i 5G (Stealth Black, 128 GB)  (6 GB RAM)","Phone size is quite large like we can't say this is a handy phone. Charging is obviously fast, display has good refresh rate and also feels good when we use the phone.MiUi is also update like i feel smoother than my past experience",5,size quite large like cant say handy charging obviously fast display refresh rate also feels use phonemiui also update like feel smoother past experience,0.19107142857142856,0.5446428571428571,231,Positive
"Xiaomi 11i 5G (Stealth Black, 128 GB)  (6 GB RAM)","Initially thought of the camera being average, but it turns out to be quite fanatic. 108mp camera works well as well as the other features. Bokeh is too good. Battery service is too decent with 67 Watt charger that within 25 mins charges upto 70%. Display and sound are really awesome. Compact package.",4,initially thought camera average turns quite fanatic mp camera works well well features bokeh battery service decent watt charger within mins charges upto display sound really awesome compact package,0.18611111111111112,0.5444444444444444,302,Positive
"Xiaomi 11i 5G (Stealth Black, 128 GB)  (6 GB RAM)",Superb...excellent 108MP clear camera.Superb symmetrical stereo sound like JBL affection.Superb display and amazing brightness.Superb smooth. Superb battery.Superb 67W charging...very fastSuperb sparkling colors..Superb feel..Superb back glass..Superb inhand feel and weight distribution.Everything is finest...I liked it and happy with satisfaction. 5 out of 5 star,5,superbexcellent mp clear camerasuperb symmetrical stereo sound like jbl affectionsuperb display amazing brightnesssuperb smooth superb batterysuperb w chargingvery fastsuperb sparkling colorssuperb feelsuperb back glasssuperb inhand feel weight distributioneverything finesti liked happy satisfaction star,0.48750000000000004,0.6229166666666667,366,Positive
"Xiaomi 11i 5G (Stealth Black, 128 GB)  (6 GB RAM)",XIAOMI 11i 5G CAMO GREEN1. SOUND - Sound is like watching movie In theater dual Dolby atmos. 2. WEIGHT -. Perfect. 3. DISPLAY -120Hz AMOLED Display quality good. 4. PROCESSOR- MTD 920 5G all rounder. 5. CAMERA- 108MP Camera & Selfie 16MP good (compare to Last used mobile Mi note 5 pro) 6. CHARGING - 67W fast charging impressive. Good Battery backup.In hand feel like Premium. CAMO GREEN COLOUR IS BEST. Go for it.,5,xiaomi g camo green sound sound like watching movie theater dual dolby atmos weight perfect display hz amoled display quality processor mtd g rounder camera mp camera selfie mp compare last used mi note pro charging w fast charging impressive battery backupin hand feel like premium camo green colour best go,0.39999999999999997,0.4851851851851852,415,Positive
"Xiaomi 11i 5G (Stealth Black, 128 GB)  (6 GB RAM)","Best in class no doubt it is very good mobile in this Price, Display super, battery🔋 full day, cameras good but more improve totally best quality in this price thanks Flipkart.",5,best class doubt price display super battery full day cameras improve totally best quality price thanks,0.5766666666666667,0.4033333333333333,176,Positive
"Xiaomi 11i 5G (Pacific Pearl, 128 GB)  (6 GB RAM)",This phone looks great in real life than in image .. must buy.. sound quality is best.. design of phone is amazing .. I loved it,5,looks real life image must buy sound quality best design amazing loved,0.5800000000000001,0.54,128,Positive
"Xiaomi 11i 5G (Pacific Pearl, 128 GB)  (6 GB RAM)",Pros1 display 2 loud speaker👌👌3  good sunlight viewing4  super touch 120 Hertz5  always on display6 good looking and build7good volg mode in cameraCons1 average camera2 bulky and heavyweight3 lack of other camera feature like redmi note 10 pro4 charging speed 50 percent is very fast   But Full charge it takpercent o 60 minutes5 no EIS and OIS in camera6 only record in 1080p 30&60 fps7   4k only 30fpsOverall good phone,4,pros display loud speaker sunlight viewing super touch hertz always display looking buildgood volg mode cameracons average camera bulky heavyweight lack camera feature like redmi note pro charging speed percent fast full charge takpercent minutes eis ois camera record p fps k fpsoverall,0.16666666666666666,0.6033333333333333,421,Positive
"Xiaomi 11i 5G (Pacific Pearl, 128 GB)  (6 GB RAM)","Best phone for this budget,,, 1st a good battery and fast charger2nd nice camera and very good new features for vlogs3rd the dimensity 920 5g processor OMG very good4th display was awesome profomence 120Hz HDR10+Overall Very Nice Phone4.5 star out of the 5Thank you Flipkart",5,best budget st battery fast chargernd camera new features vlogsrd dimensity g processor omg goodth display awesome profomence hz hdroverall star thank,0.5840909090909091,0.5886363636363636,274,Positive
"Xiaomi 11i 5G (Pacific Pearl, 128 GB)  (6 GB RAM)",This phone is a perfect all rounder with some compromise s in this segment. I will prefer the 11i over the hypercharge. 11i has all the same features at lower price. Display is good and bright but i noticed Mi 11 lite feels much better and brighter some times. Battery life is too good. But camera is bit disappointed not as good as expected in this price range. Low light experience was very poor . Video quality is just ok. If you are a camera lover then this phone is not ok for you. I hope...,4,perfect rounder compromise segment prefer hypercharge features lower price display bright noticed mi lite feels much better brighter times battery life camera bit disappointed expected price range low light experience poor video quality ok camera lover ok hope,0.23500000000000001,0.6049999999999999,496,Positive
"Xiaomi 11i 5G (Pacific Pearl, 128 GB)  (6 GB RAM)","Good for the money I paid for 67 W varient. After using for 4 hours battery drained by 20% which is too good! Camera is very very very very poor and needs to be improved. Hopefully gets good with updates. If camera is your 1st priority then please avoid this. Go for it if you want best battery, best display, best looks and good performance!",4,money paid w varient using hours battery drained camera poor needs improved hopefully gets updates camera st priority please avoid go want best battery best display best looks performance,0.65,0.375,342,Positive
"Xiaomi 11i 5G (Pacific Pearl, 128 GB)  (6 GB RAM)","Phone size is quite large like we can't say this is a handy phone. Charging is obviously fast, display has good refresh rate and also feels good when we use the phone.MiUi is also update like i feel smoother than my past experience",5,size quite large like cant say handy charging obviously fast display refresh rate also feels use phonemiui also update like feel smoother past experience,0.19107142857142856,0.5446428571428571,231,Positive
"Xiaomi 11i 5G (Pacific Pearl, 128 GB)  (6 GB RAM)","Initially thought of the camera being average, but it turns out to be quite fanatic. 108mp camera works well as well as the other features. Bokeh is too good. Battery service is too decent with 67 Watt charger that within 25 mins charges upto 70%. Display and sound are really awesome. Compact package.",4,initially thought camera average turns quite fanatic mp camera works well well features bokeh battery service decent watt charger within mins charges upto display sound really awesome compact package,0.18611111111111112,0.5444444444444444,302,Positive
"Xiaomi 11i 5G (Pacific Pearl, 128 GB)  (6 GB RAM)",Superb...excellent 108MP clear camera.Superb symmetrical stereo sound like JBL affection.Superb display and amazing brightness.Superb smooth. Superb battery.Superb 67W charging...very fastSuperb sparkling colors..Superb feel..Superb back glass..Superb inhand feel and weight distribution.Everything is finest...I liked it and happy with satisfaction. 5 out of 5 star,5,superbexcellent mp clear camerasuperb symmetrical stereo sound like jbl affectionsuperb display amazing brightnesssuperb smooth superb batterysuperb w chargingvery fastsuperb sparkling colorssuperb feelsuperb back glasssuperb inhand feel weight distributioneverything finesti liked happy satisfaction star,0.48750000000000004,0.6229166666666667,366,Positive
"Xiaomi 11i 5G (Pacific Pearl, 128 GB)  (6 GB RAM)",XIAOMI 11i 5G CAMO GREEN1. SOUND - Sound is like watching movie In theater dual Dolby atmos. 2. WEIGHT -. Perfect. 3. DISPLAY -120Hz AMOLED Display quality good. 4. PROCESSOR- MTD 920 5G all rounder. 5. CAMERA- 108MP Camera & Selfie 16MP good (compare to Last used mobile Mi note 5 pro) 6. CHARGING - 67W fast charging impressive. Good Battery backup.In hand feel like Premium. CAMO GREEN COLOUR IS BEST. Go for it.,5,xiaomi g camo green sound sound like watching movie theater dual dolby atmos weight perfect display hz amoled display quality processor mtd g rounder camera mp camera selfie mp compare last used mi note pro charging w fast charging impressive battery backupin hand feel like premium camo green colour best go,0.39999999999999997,0.4851851851851852,415,Positive
"Xiaomi 11i 5G (Pacific Pearl, 128 GB)  (6 GB RAM)","Best in class no doubt it is very good mobile in this Price, Display super, battery🔋 full day, cameras good but more improve totally best quality in this price thanks Flipkart.",5,best class doubt price display super battery full day cameras improve totally best quality price thanks,0.5766666666666667,0.4033333333333333,176,Positive
"Xiaomi 11i 5G (Purple Mist, 128 GB)  (8 GB RAM)","Honest review after using it for three days.1. Look and feel - Awesome! Camo Green colour is amazing. It's very handy and comfortable in typing.2. Performance - Very Good.3. Display and refresh rate - I feel the refresh rate is not well optimised, still good. Hopefully, system updates will make it smoother. Till now I haven't felt any lag.4. Battery and charging - Good battery backup of 1-day on normal use, if you're a heavy user then it depends. Full charge in 45-50 mins (normal charge ...",5,honest review using three days look feel awesome camo green colour amazing handy comfortable typing performance display refresh rate feel refresh rate well optimised still hopefully system updates make smoother till havent felt lag battery charging battery backup day normal use youre heavy user depends full charge mins normal charge,0.345,0.7149999999999999,495,Positive
"Xiaomi 11i 5G (Purple Mist, 128 GB)  (8 GB RAM)","Just awesome 🔥I have been using it since for 5 days Battery performance is better Selfie camera is 🔥Rear camera is also good daylight photos are decent but there is little problem in low light photos, Rest all other features are awesome.Games like Pubg, free fire are working good with Dimensity 920 processor.",5,awesome using since days battery performance better selfie camera rear camera also daylight photos decent little problem low light photos rest features awesomegames like pubg free fire working dimensity processor,0.3255952380952381,0.6380952380952379,310,Positive
"Xiaomi 11i 5G (Purple Mist, 128 GB)  (8 GB RAM)","Am giving this review after usage of complete 1 day..!! Rear Camera Not Upto the expectation level (108mp) in Dim Lights But in sunlight its really good, Front Camera is really Good more than expectations, Overall Worth for Money, No laggings Good processor.. More than all above i love the stereo Dolby effects Semma Quality in while hearing Musics &  HD Videos Amazing Sound effect mild to hear. <3",4,giving review usage complete day rear camera upto expectation level mp dim lights sunlight really front camera really expectations overall worth money laggings processor love stereo dolby effects semma quality hearing musics hd videos amazing sound effect mild hear,0.2733333333333333,0.38,400,Positive
"Xiaomi 11i 5G (Purple Mist, 128 GB)  (8 GB RAM)","MI 11i is Good Mobile in 2022, Camera 1000% Good, Battery is 100% Good, Display is Good, Calls Voice also Good, I'm Very Happy to Use this MI 11i Mobile. Lovely All 😍",5,mi camera battery display calls voice also im happy use mi lovely,0.65,0.875,166,Positive
"Xiaomi 11i 5G (Purple Mist, 128 GB)  (8 GB RAM)","The phone is great there are some functions that i think lacks in the phone like in display fingerprint , 256 gb storage should have been given according to the price of phone with 12 gb ram,,and there isn't second space in the phone ...otherwise phone is great 120hz refresh rate is a blast 👍👍and dont buy it for playing bgmi it have 60fps support but it never maintains 60 fps it drops to 40 as you start playing even at mylta 😂",4,functions think lacks like display fingerprint gb storage given according price gb ramand isnt second space otherwise hz refresh rate blast dont buy playing bgmi fps support never maintains fps drops start playing even mylta,0.0,0.0,430,Neutral
"Xiaomi 11i 5G (Purple Mist, 128 GB)  (8 GB RAM)",Camera quality is not too good.,3,camera quality,0.0,0.0,31,Neutral
"Xiaomi 11i 5G (Purple Mist, 128 GB)  (8 GB RAM)","11i 8gb version: Battery: Lasts all day, even with using Social Media and music. 67W charger is more than enough for daily use. I bought this phone mainly because it offered more battery capacity than the hypercharge version.I plug it in the morning after waking up and by the time in done with breakfast (approx 40mins), phone is full.Speakers: Dual stereo speakers, one on top and one on bottom. Symmetric sound. Impossibly loud and crisp. You can hear the phone from the other room also cle...",4,gb version battery lasts day even using social media music w charger enough daily use bought mainly offered battery capacity hypercharge versioni plug morning waking time done breakfast approx mins fullspeakers dual stereo speakers one top one bottom symmetric sound impossibly loud crisp hear room also cle,0.18125000000000002,0.37708333333333327,496,Positive
"Xiaomi 11i 5G (Purple Mist, 128 GB)  (8 GB RAM)","11i 5g mobiles performance and operating very fast, camera 108 MG very good quality. Sounds very clear and double speekar very good lowd and clear hipper charge no over hit complaint value for money very good product 👍👍👍💯👌",5,g mobiles performance operating fast camera mg quality sounds clear double speekar lowd clear hipper charge hit complaint value money,0.019999999999999997,0.31333333333333335,222,Neutral
"Xiaomi 11i 5G (Purple Mist, 128 GB)  (8 GB RAM)",Writing this review after a use of 3 days.I have bought 8gb 128gb variant in Pacific Pearl color.Firstly the phone looks elegant when in hand and the fact that it is coupled with dimensity 920 chipset makes this phone a performance beast.Until now I have not faced any issues with the phone.120 hz display feels like butter on fingers..and gaming experience is on the next level with a classy display. Although I've purchased the 67 watt charging variant the charging speed is not bad at all...,5,writing review use daysi bought gb gb variant pacific pearl colorfirstly looks elegant hand fact coupled dimensity chipset makes performance beastuntil faced issues hz display feels like butter fingersand gaming experience next level classy display although ive purchased watt charging variant charging speed bad,-0.024999999999999967,0.6416666666666666,494,Neutral
"Xiaomi 11i 5G (Purple Mist, 128 GB)  (8 GB RAM)","I have it's 8/128 variant, and it's perfectly working very decent, dimensity 920 is a very good optimised proccessor , no hitting issu after heavy usages, no lagg issu, sound is absolutely stunning with dual speaker Dolby Atmos, Only issu I have faced low light camera quality, it's struggle a bit in low light, but in daylight it's very good , but not excellent which can be fixed in software update.But I must say , yes this phone is very powerful in terms of performance. Go for it, it can b...",5,variant perfectly working decent dimensity optimised proccessor hitting issu heavy usages lagg issu sound absolutely stunning dual speaker dolby atmos issu faced low light camera quality struggle bit low light daylight excellent fixed software updatebut must say yes powerful terms performance go b,0.33888888888888885,0.6472222222222223,497,Positive
"Xiaomi 11i 5G (Stealth Black, 128 GB)  (8 GB RAM)","Honest review after using it for three days.1. Look and feel - Awesome! Camo Green colour is amazing. It's very handy and comfortable in typing.2. Performance - Very Good.3. Display and refresh rate - I feel the refresh rate is not well optimised, still good. Hopefully, system updates will make it smoother. Till now I haven't felt any lag.4. Battery and charging - Good battery backup of 1-day on normal use, if you're a heavy user then it depends. Full charge in 45-50 mins (normal charge ...",5,honest review using three days look feel awesome camo green colour amazing handy comfortable typing performance display refresh rate feel refresh rate well optimised still hopefully system updates make smoother till havent felt lag battery charging battery backup day normal use youre heavy user depends full charge mins normal charge,0.345,0.7149999999999999,495,Positive
"Xiaomi 11i 5G (Stealth Black, 128 GB)  (8 GB RAM)","Just awesome 🔥I have been using it since for 5 days Battery performance is better Selfie camera is 🔥Rear camera is also good daylight photos are decent but there is little problem in low light photos, Rest all other features are awesome.Games like Pubg, free fire are working good with Dimensity 920 processor.",5,awesome using since days battery performance better selfie camera rear camera also daylight photos decent little problem low light photos rest features awesomegames like pubg free fire working dimensity processor,0.3255952380952381,0.6380952380952379,310,Positive
"Xiaomi 11i 5G (Stealth Black, 128 GB)  (8 GB RAM)","Am giving this review after usage of complete 1 day..!! Rear Camera Not Upto the expectation level (108mp) in Dim Lights But in sunlight its really good, Front Camera is really Good more than expectations, Overall Worth for Money, No laggings Good processor.. More than all above i love the stereo Dolby effects Semma Quality in while hearing Musics &  HD Videos Amazing Sound effect mild to hear. <3",4,giving review usage complete day rear camera upto expectation level mp dim lights sunlight really front camera really expectations overall worth money laggings processor love stereo dolby effects semma quality hearing musics hd videos amazing sound effect mild hear,0.2733333333333333,0.38,400,Positive
"Xiaomi 11i 5G (Stealth Black, 128 GB)  (8 GB RAM)","MI 11i is Good Mobile in 2022, Camera 1000% Good, Battery is 100% Good, Display is Good, Calls Voice also Good, I'm Very Happy to Use this MI 11i Mobile. Lovely All 😍",5,mi camera battery display calls voice also im happy use mi lovely,0.65,0.875,166,Positive
"Xiaomi 11i 5G (Stealth Black, 128 GB)  (8 GB RAM)","The phone is great there are some functions that i think lacks in the phone like in display fingerprint , 256 gb storage should have been given according to the price of phone with 12 gb ram,,and there isn't second space in the phone ...otherwise phone is great 120hz refresh rate is a blast 👍👍and dont buy it for playing bgmi it have 60fps support but it never maintains 60 fps it drops to 40 as you start playing even at mylta 😂",4,functions think lacks like display fingerprint gb storage given according price gb ramand isnt second space otherwise hz refresh rate blast dont buy playing bgmi fps support never maintains fps drops start playing even mylta,0.0,0.0,430,Neutral
"Xiaomi 11i 5G (Stealth Black, 128 GB)  (8 GB RAM)",Camera quality is not too good.,3,camera quality,0.0,0.0,31,Neutral
"Xiaomi 11i 5G (Stealth Black, 128 GB)  (8 GB RAM)","11i 8gb version: Battery: Lasts all day, even with using Social Media and music. 67W charger is more than enough for daily use. I bought this phone mainly because it offered more battery capacity than the hypercharge version.I plug it in the morning after waking up and by the time in done with breakfast (approx 40mins), phone is full.Speakers: Dual stereo speakers, one on top and one on bottom. Symmetric sound. Impossibly loud and crisp. You can hear the phone from the other room also cle...",4,gb version battery lasts day even using social media music w charger enough daily use bought mainly offered battery capacity hypercharge versioni plug morning waking time done breakfast approx mins fullspeakers dual stereo speakers one top one bottom symmetric sound impossibly loud crisp hear room also cle,0.18125000000000002,0.37708333333333327,496,Positive
"Xiaomi 11i 5G (Stealth Black, 128 GB)  (8 GB RAM)","11i 5g mobiles performance and operating very fast, camera 108 MG very good quality. Sounds very clear and double speekar very good lowd and clear hipper charge no over hit complaint value for money very good product 👍👍👍💯👌",5,g mobiles performance operating fast camera mg quality sounds clear double speekar lowd clear hipper charge hit complaint value money,0.019999999999999997,0.31333333333333335,222,Neutral
"Xiaomi 11i 5G (Stealth Black, 128 GB)  (8 GB RAM)",Writing this review after a use of 3 days.I have bought 8gb 128gb variant in Pacific Pearl color.Firstly the phone looks elegant when in hand and the fact that it is coupled with dimensity 920 chipset makes this phone a performance beast.Until now I have not faced any issues with the phone.120 hz display feels like butter on fingers..and gaming experience is on the next level with a classy display. Although I've purchased the 67 watt charging variant the charging speed is not bad at all...,5,writing review use daysi bought gb gb variant pacific pearl colorfirstly looks elegant hand fact coupled dimensity chipset makes performance beastuntil faced issues hz display feels like butter fingersand gaming experience next level classy display although ive purchased watt charging variant charging speed bad,-0.024999999999999967,0.6416666666666666,494,Neutral
"Xiaomi 11i 5G (Stealth Black, 128 GB)  (8 GB RAM)","I have it's 8/128 variant, and it's perfectly working very decent, dimensity 920 is a very good optimised proccessor , no hitting issu after heavy usages, no lagg issu, sound is absolutely stunning with dual speaker Dolby Atmos, Only issu I have faced low light camera quality, it's struggle a bit in low light, but in daylight it's very good , but not excellent which can be fixed in software update.But I must say , yes this phone is very powerful in terms of performance. Go for it, it can b...",5,variant perfectly working decent dimensity optimised proccessor hitting issu heavy usages lagg issu sound absolutely stunning dual speaker dolby atmos issu faced low light camera quality struggle bit low light daylight excellent fixed software updatebut must say yes powerful terms performance go b,0.33888888888888885,0.6472222222222223,497,Positive
"Redmi 9A Sport (Coral Green, 32 GB)  (3 GB RAM)",Phone working is Very Good,5,working,0.0,0.0,26,Neutral
"Redmi 9A Sport (Coral Green, 32 GB)  (3 GB RAM)",Nice,5,,0.0,0.0,4,Neutral
