Product_name,Review,Rating,Cleaned_Review,Polarity,Subjectivity,Review_Length,Sentiment
"realme 8i (Space Purple, 64 GB)  (4 GB RAM)","Positive Site ::——1. Performance – is very good2. Display – Display is good but it would have been better if it was a little brighter but ok3. Fingerprint sensor and Face unlock is very fastNegative Site ::——1. Camera – The quality of the camera is not good at all, the detailing does not come at all, better than this, photos are clicked in Redmi 9 Power2. Battery – Battery performance is fine but charging is very slow, from 0% to 50% it takes 35 to 40 minutes but it takes 1:30 hours t...",2,positive site performance display display would better little brighter ok fingerprint sensor face unlock fastnegative site camera quality camera detailing come better photos clicked redmi power battery battery performance fine charging slow takes minutes takes hours,0.23663419913419914,0.4922077922077922,492,Positive
"realme 8i (Space Purple, 64 GB)  (4 GB RAM)",Display was good touch response was also good.. appreciatedCamera and performance was good..no doubt 50mpLovely..Battery capacity was good 1 half day without charge.. quick charge 2 hours..Overall Good At This Price Segment.. Appreciated RealmeG96 was not so stable but it will be fix by updates..No more expectations..G95 was stable and support 60fps.. recording and gaming..,4,display touch response also appreciatedcamera performance goodno doubt mplovelybattery capacity half day without charge quick charge hoursoverall price segment appreciated realmeg stable fix updatesno expectationsg stable support fps recording gaming,0.12222222222222223,0.25555555555555554,376,Positive
"realme 8i (Space Black, 64 GB)  (4 GB RAM)",Very nice phone at this price pointProcessor is awesome Camera is average Battery is good FHD +Display is very good but not amoled,5,price pointprocessor awesome camera average battery fhd display amoled,0.425,0.7,130,Positive
"realme 8i (Space Black, 64 GB)  (4 GB RAM)",All things about realme 8i is at the top. But you have to be patient regard it's charging.. it take _> 2 hrs till it's full charge. Camera is osm🥳 loved 💕 it,5,things realme top patient regard charging take hrs till full charge camera osm loved,0.5166666666666666,0.6166666666666667,157,Positive
"realme 8i (Space Black, 64 GB)  (4 GB RAM)","The smartphone comes with a big display of 6.6 inches with an IPS LCD capacitive touchscreen. The resolution is 1080 x 2412 pixels and the screen PPI is 400. The operating system of the device is Android 11 + Realme UI 2.0. The smartphone is powered by a Mediatek Helio G96 Octa-core processor and the GPU is Mali-G57 MC2. The internal storage is 128 GB with 4 GB RAM. Realme 8i consists of a triple-camera 50 MP (wide) + 2 MP (macro) + 2 MP (depth). On the front, there is a single 16 MP (wide) c...",5,smartphone comes big display inches ips lcd capacitive touchscreen resolution x pixels screen ppi operating system device android realme ui smartphone powered mediatek helio g octacore processor gpu malig mc internal storage gb gb ram realme consists triplecamera mp wide mp macro mp depth front single mp wide c,-0.05428571428571429,0.22285714285714286,500,Negative
"realme 8i (Space Black, 64 GB)  (4 GB RAM)",Best Phone Ever. Don't Think Just buy this guys. Best camera . Also looking awesome. Fast display.Awesime Features.But 1 think is disappointed that is Battery consumption is little bit fast . Otherwise This is the best Phone . Go for It !,4,best ever dont think buy guys best camera also looking awesome fast displayawesime featuresbut think disappointed battery consumption little bit fast otherwise best go,0.43281250000000004,0.54375,238,Positive
"realme 8i (Space Black, 64 GB)  (4 GB RAM)",It is a good phone under this price range. Camera is good along with its UI. O for it if you have a tight budget. There is no earphones available at box so keep it in mind. If you have budget of more than 13000 than go for Mi 10 pro or vivo or poco.,3,price range camera along ui tight budget earphones available box keep mind budget go mi pro vivo poco,0.11071428571428572,0.34285714285714286,249,Positive
"realme 8i (Space Black, 64 GB)  (4 GB RAM)",You can play pubg with 40fps only smooth plus ultra only   ..for normal gaming this is good enough but for competitive it's not that good ...Camera is good enough at this price Battery is outstandingDisplay is not so good but 120hz  feels better Phone heats while charging and playing heavy games  Finally at this price you can choose this phone there is no better option apart from thisI was disappointed with flipkart for  late  delivery..😓😥,3,play pubg fps smooth plus ultra normal gaming enough competitive camera enough price battery outstandingdisplay hz feels better heats charging playing heavy games finally price choose better option apart thisi disappointed late delivery,0.03000000000000001,0.6,443,Neutral
"realme 8i (Space Black, 64 GB)  (4 GB RAM)","Phone is very good according to the price, its camera quality is Well  good picture is just like iPhone.First you buy it then trust it. Trust in my experience after purchase this phone. The phone is in affordable price. Best battery backup. I have received this phone today. Selfie camera is also good. Overall performance is excellent . Trust me you won't regret this phone.",5,according price camera quality well picture like iphonefirst buy trust trust experience purchase affordable price best battery backup received today selfie camera also overall performance excellent trust wont regret,0.6666666666666666,0.43333333333333335,375,Positive
"realme 8i (Space Black, 64 GB)  (4 GB RAM)",Nice phone 📱 back camera es so nice zoom clean zooming pic sellfie camera nice thank you flipkartI I'm today happy I play free 🔥🔥🔥🔥,5,back camera es zoom clean zooming pic sellfie camera thank flipkarti im today happy play free,0.3916666666666667,0.625,131,Positive
"realme 8i (Space Black, 64 GB)  (4 GB RAM)","Positive Site ::——1. Performance – is very good2. Display – Display is good but it would have been better if it was a little brighter but ok3. Fingerprint sensor and Face unlock is very fastNegative Site ::——1. Camera – The quality of the camera is not good at all, the detailing does not come at all, better than this, photos are clicked in Redmi 9 Power2. Battery – Battery performance is fine but charging is very slow, from 0% to 50% it takes 35 to 40 minutes but it takes 1:30 hours t...",2,positive site performance display display would better little brighter ok fingerprint sensor face unlock fastnegative site camera quality camera detailing come better photos clicked redmi power battery battery performance fine charging slow takes minutes takes hours,0.23663419913419914,0.4922077922077922,492,Positive
"realme 8i (Space Black, 64 GB)  (4 GB RAM)",Display was good touch response was also good.. appreciatedCamera and performance was good..no doubt 50mpLovely..Battery capacity was good 1 half day without charge.. quick charge 2 hours..Overall Good At This Price Segment.. Appreciated RealmeG96 was not so stable but it will be fix by updates..No more expectations..G95 was stable and support 60fps.. recording and gaming..,4,display touch response also appreciatedcamera performance goodno doubt mplovelybattery capacity half day without charge quick charge hoursoverall price segment appreciated realmeg stable fix updatesno expectationsg stable support fps recording gaming,0.12222222222222223,0.25555555555555554,376,Positive
"realme 8i (Space Black, 128 GB)  (6 GB RAM)","Loved the phone, very responsive.Few features I would highlight:1. Face unlock and side thumb are super nice2. UI is awesome3. Can put Jio sim in second slot and still use it when internet enabled for first sim4. can use wifi and carrier internet together to get improved speed (haven't tried yet)5. Case available in box6. metalic lookFew things which are not good:1. No indicator for charging2. Back LED is very dim3. Fingerprint magnet4. No auto call recording5. Call recording f...",4,loved responsivefew features would highlight face unlock side thumb super ui awesome put jio sim second slot still use internet enabled first sim use wifi carrier internet together get improved speed havent tried yet case available box metalic lookfew things indicator charging back led dim fingerprint magnet auto call recording call recording f,0.34791666666666665,0.4625,485,Positive
"realme 8i (Space Black, 128 GB)  (6 GB RAM)","mobile is good. overall design and build is nice and feel good to hold on to it. camera is above average better compere to other phones in this segment. display bright and smooth. speaker is okay. os there is bloat some of em we can remove but not all, the one bad thing is need to accept terms and conditions before using each action like app search, launcher etc there is no options to opt out.",4,overall design build feel hold camera average better compere phones segment display bright smooth speaker okay os bloat em remove one bad thing need accept terms conditions using action like app search launcher etc options opt,0.16875000000000007,0.4333333333333333,396,Positive
"realme 8i (Space Black, 128 GB)  (6 GB RAM)","💛Great phone, very very smooth💛⭐📸 Camera is good ⏩: 4.5/5⭐ Better Performance and smoothly MT Helio G96 ⏩:4.5/5⭐ fast changer is great (18w fast changer)⏩ : 4.5/5⭐📱Display is great and silky smooth 120Hz refresh rate(6.6-inch)⏩: 4.5/5⭐🔋 backup is great(5000mah massive battery)⏩: 4.5/5⭐Realme UI 2.0 is awesome👍⭐Dynamic ram is  perfect👍⭐Fingerprint is very very fast😱⭐Face unlock is very very fast😱⭐Touch responding is very fast (180HZ touch    sample rate)👍⭐Brightness is g...",5,smooth camera better performance smoothly mt helio g fast changer w fast changer display silky smooth hz refresh rateinch backup greatmah massive battery realme ui awesomedynamic ram perfectfingerprint fastface unlock fasttouch responding fast hz touch sample ratebrightness g,0.28750000000000003,0.6,477,Positive
"realme 8i (Space Black, 128 GB)  (6 GB RAM)","Very great item. I like the product, colour is awsome, battery is so long, and main thing is display supports 120 hz",5,item like colour awsome battery long main thing display supports hz,0.05833333333333333,0.3666666666666667,116,Positive
"realme 8i (Space Black, 128 GB)  (6 GB RAM)",This Phone is Very Fast and touch is sensitive and refresh rate  makes it very powerful. It's camera  also capturing awesome pictures. I love this product ....must buy🥰,5,fast touch sensitive refresh rate makes powerful camera also capturing awesome pictures love must buy,0.42000000000000004,0.82,168,Positive
"realme 8i (Space Black, 128 GB)  (6 GB RAM)",Camera quality overall good . Front camera is good but back camera is not as good as I think 🤔,4,camera quality overall front camera back camera think,0.0,0.0,94,Neutral
"realme 8i (Space Black, 128 GB)  (6 GB RAM)",Thanks flipkart for fast delivery I love this phone value for money best camera good battery life. I m doing this review after two weeks after using this phone i recommend realme 8i .,5,thanks fast delivery love value money best camera battery life review two weeks using recommend realme,0.475,0.425,183,Positive
"realme 8i (Space Black, 128 GB)  (6 GB RAM)",This mobile has some new interesting features but it has no auto call recording option and song ringtones will not be appear in this phone. Over all new and stylish so and so satisfied but not fully. Rear camera quality is very good and effective in daylight and night light also. Front camera has Sean clear pictures but not sharpen picture.,4,new interesting features auto call recording option song ringtones appear new stylish satisfied fully rear camera quality effective daylight night light also front camera sean clear pictures sharpen picture,0.35909090909090907,0.6615530303030304,342,Positive
"realme 8i (Space Black, 128 GB)  (6 GB RAM)","I would like to give one star because of its primary camera. Its name only 50mp bt it's actually less than 10mp.2nd most imp point. It's heating issue. Its like an heater after 5min of use.Display is ok, Selfie is like 2mpFinger print is not working properly.Application doesn't work properly.Apps not supporting.Hotspot issue.It's not worth for money.It's price range should be 1000 to 2000 max to max",1,would like give one star primary camera name mp bt actually less mpnd imp point heating issue like heater min usedisplay ok selfie like mpfinger print working properlyapplication doesnt work properlyapps supportinghotspot issueits worth moneyits price range max max,0.25833333333333336,0.2916666666666667,402,Positive
"realme 8i (Space Black, 128 GB)  (6 GB RAM)",Good phone.. could have been better if s.amoled display had been added... Fullhd+lcd display is not up to the mark... No clearity when  watching online videos.. smooth working with mediatek Helio ge96 octa core processor.. rear camera is good but front camera is not up to the mark.. specialy I m disappointed with lcd display It has provided...,2,could better samoled display added fullhdlcd display mark clearity watching online videos smooth working mediatek helio ge octa core processor rear camera front camera mark specialy disappointed lcd display provided,0.05000000000000001,0.5833333333333334,345,Positive
"realme 8i (Space Purple, 128 GB)  (6 GB RAM)","Loved the phone, very responsive.Few features I would highlight:1. Face unlock and side thumb are super nice2. UI is awesome3. Can put Jio sim in second slot and still use it when internet enabled for first sim4. can use wifi and carrier internet together to get improved speed (haven't tried yet)5. Case available in box6. metalic lookFew things which are not good:1. No indicator for charging2. Back LED is very dim3. Fingerprint magnet4. No auto call recording5. Call recording f...",4,loved responsivefew features would highlight face unlock side thumb super ui awesome put jio sim second slot still use internet enabled first sim use wifi carrier internet together get improved speed havent tried yet case available box metalic lookfew things indicator charging back led dim fingerprint magnet auto call recording call recording f,0.34791666666666665,0.4625,485,Positive
"realme 8i (Space Purple, 128 GB)  (6 GB RAM)","mobile is good. overall design and build is nice and feel good to hold on to it. camera is above average better compere to other phones in this segment. display bright and smooth. speaker is okay. os there is bloat some of em we can remove but not all, the one bad thing is need to accept terms and conditions before using each action like app search, launcher etc there is no options to opt out.",4,overall design build feel hold camera average better compere phones segment display bright smooth speaker okay os bloat em remove one bad thing need accept terms conditions using action like app search launcher etc options opt,0.16875000000000007,0.4333333333333333,396,Positive
"realme 8i (Space Purple, 128 GB)  (6 GB RAM)","💛Great phone, very very smooth💛⭐📸 Camera is good ⏩: 4.5/5⭐ Better Performance and smoothly MT Helio G96 ⏩:4.5/5⭐ fast changer is great (18w fast changer)⏩ : 4.5/5⭐📱Display is great and silky smooth 120Hz refresh rate(6.6-inch)⏩: 4.5/5⭐🔋 backup is great(5000mah massive battery)⏩: 4.5/5⭐Realme UI 2.0 is awesome👍⭐Dynamic ram is  perfect👍⭐Fingerprint is very very fast😱⭐Face unlock is very very fast😱⭐Touch responding is very fast (180HZ touch    sample rate)👍⭐Brightness is g...",5,smooth camera better performance smoothly mt helio g fast changer w fast changer display silky smooth hz refresh rateinch backup greatmah massive battery realme ui awesomedynamic ram perfectfingerprint fastface unlock fasttouch responding fast hz touch sample ratebrightness g,0.28750000000000003,0.6,477,Positive
"realme 8i (Space Purple, 128 GB)  (6 GB RAM)","Very great item. I like the product, colour is awsome, battery is so long, and main thing is display supports 120 hz",5,item like colour awsome battery long main thing display supports hz,0.05833333333333333,0.3666666666666667,116,Positive
"realme 8i (Space Purple, 128 GB)  (6 GB RAM)",This Phone is Very Fast and touch is sensitive and refresh rate  makes it very powerful. It's camera  also capturing awesome pictures. I love this product ....must buy🥰,5,fast touch sensitive refresh rate makes powerful camera also capturing awesome pictures love must buy,0.42000000000000004,0.82,168,Positive
"realme 8i (Space Purple, 128 GB)  (6 GB RAM)",Camera quality overall good . Front camera is good but back camera is not as good as I think 🤔,4,camera quality overall front camera back camera think,0.0,0.0,94,Neutral
"realme 8i (Space Purple, 128 GB)  (6 GB RAM)",Thanks flipkart for fast delivery I love this phone value for money best camera good battery life. I m doing this review after two weeks after using this phone i recommend realme 8i .,5,thanks fast delivery love value money best camera battery life review two weeks using recommend realme,0.475,0.425,183,Positive
"realme 8i (Space Purple, 128 GB)  (6 GB RAM)",This mobile has some new interesting features but it has no auto call recording option and song ringtones will not be appear in this phone. Over all new and stylish so and so satisfied but not fully. Rear camera quality is very good and effective in daylight and night light also. Front camera has Sean clear pictures but not sharpen picture.,4,new interesting features auto call recording option song ringtones appear new stylish satisfied fully rear camera quality effective daylight night light also front camera sean clear pictures sharpen picture,0.35909090909090907,0.6615530303030304,342,Positive
"realme 8i (Space Purple, 128 GB)  (6 GB RAM)","I would like to give one star because of its primary camera. Its name only 50mp bt it's actually less than 10mp.2nd most imp point. It's heating issue. Its like an heater after 5min of use.Display is ok, Selfie is like 2mpFinger print is not working properly.Application doesn't work properly.Apps not supporting.Hotspot issue.It's not worth for money.It's price range should be 1000 to 2000 max to max",1,would like give one star primary camera name mp bt actually less mpnd imp point heating issue like heater min usedisplay ok selfie like mpfinger print working properlyapplication doesnt work properlyapps supportinghotspot issueits worth moneyits price range max max,0.25833333333333336,0.2916666666666667,402,Positive
"realme 8i (Space Purple, 128 GB)  (6 GB RAM)",Good phone.. could have been better if s.amoled display had been added... Fullhd+lcd display is not up to the mark... No clearity when  watching online videos.. smooth working with mediatek Helio ge96 octa core processor.. rear camera is good but front camera is not up to the mark.. specialy I m disappointed with lcd display It has provided...,2,could better samoled display added fullhdlcd display mark clearity watching online videos smooth working mediatek helio ge octa core processor rear camera front camera mark specialy disappointed lcd display provided,0.05000000000000001,0.5833333333333334,345,Positive
"realme Narzo 50i (Carbon Black, 32 GB)  (2 GB RAM)",Nice looking mobile with amazing color and good camera quality in this range.Only issue was with delivery. I got this after 10 days. Buy overall I satisfied with this product.,3,looking amazing color camera quality rangeonly issue delivery got days buy overall satisfied,0.3666666666666667,0.6333333333333333,175,Positive
"realme Narzo 50i (Carbon Black, 32 GB)  (2 GB RAM)",Thank you realme very very good product best budget mobile thank you Flipkart thank you realme I am happy,5,thank realme best budget thank thank realme happy,0.9,0.65,105,Positive
"realme Narzo 50i (Carbon Black, 32 GB)  (2 GB RAM)",A budget friendly purchase for sure. The rear camera is good but the front camera is average. Could be better. No finger print sensor available but face lock available.,4,budget friendly purchase sure rear camera front camera average could better finger print sensor available face lock available,0.33749999999999997,0.5148148148148147,168,Positive
"realme Narzo 50i (Carbon Black, 32 GB)  (2 GB RAM)",Not a good product from realmePlease don't buy this,1,realmeplease dont buy,0.0,0.0,51,Neutral
"realme Narzo 50i (Carbon Black, 32 GB)  (2 GB RAM)",Look was good but daily task struggle to do and camera poor qualityDon't buy You have better option,1,look daily task struggle camera poor qualitydont buy better option,0.033333333333333326,0.3666666666666667,99,Neutral
"realme Narzo 50i (Carbon Black, 32 GB)  (2 GB RAM)",No advice for this mobile.,1,advice,0.0,0.0,26,Neutral
"realme Narzo 50i (Carbon Black, 32 GB)  (2 GB RAM)",Camera quality looks very average. It needs some sort of improvement by updates,1,camera quality looks average needs sort improvement updates,-0.15,0.39999999999999997,79,Negative
"realme Narzo 50i (Carbon Black, 32 GB)  (2 GB RAM)","It's a android go phone , don't go for it if your are buying for yourself. If you are buying for only video call to mother or grand parents , then it's ok. I bought and it's not able to connect to any wifi in two days.",1,android go dont go buying buying video call mother grand parents ok bought able connect wifi two days,0.5,0.7083333333333334,218,Positive
"realme Narzo 50i (Carbon Black, 32 GB)  (2 GB RAM)",Don't purchase this smartphone 👎,1,dont purchase smartphone,0.0,0.0,32,Neutral
"realme Narzo 50i (Carbon Black, 32 GB)  (2 GB RAM)",Loss off money,1,loss money,0.0,0.0,14,Neutral
"realme Narzo 50i (Mint Green, 32 GB)  (2 GB RAM)",Nice looking mobile with amazing color and good camera quality in this range.Only issue was with delivery. I got this after 10 days. Buy overall I satisfied with this product.,3,looking amazing color camera quality rangeonly issue delivery got days buy overall satisfied,0.3666666666666667,0.6333333333333333,175,Positive
"realme Narzo 50i (Mint Green, 32 GB)  (2 GB RAM)",Thank you realme very very good product best budget mobile thank you Flipkart thank you realme I am happy,5,thank realme best budget thank thank realme happy,0.9,0.65,105,Positive
"realme Narzo 50i (Mint Green, 32 GB)  (2 GB RAM)",A budget friendly purchase for sure. The rear camera is good but the front camera is average. Could be better. No finger print sensor available but face lock available.,4,budget friendly purchase sure rear camera front camera average could better finger print sensor available face lock available,0.33749999999999997,0.5148148148148147,168,Positive
"realme Narzo 50i (Mint Green, 32 GB)  (2 GB RAM)",Not a good product from realmePlease don't buy this,1,realmeplease dont buy,0.0,0.0,51,Neutral
"realme Narzo 50i (Mint Green, 32 GB)  (2 GB RAM)",Look was good but daily task struggle to do and camera poor qualityDon't buy You have better option,1,look daily task struggle camera poor qualitydont buy better option,0.033333333333333326,0.3666666666666667,99,Neutral
"realme Narzo 50i (Mint Green, 32 GB)  (2 GB RAM)",No advice for this mobile.,1,advice,0.0,0.0,26,Neutral
"realme Narzo 50i (Mint Green, 32 GB)  (2 GB RAM)",Camera quality looks very average. It needs some sort of improvement by updates,1,camera quality looks average needs sort improvement updates,-0.15,0.39999999999999997,79,Negative
"realme Narzo 50i (Mint Green, 32 GB)  (2 GB RAM)","It's a android go phone , don't go for it if your are buying for yourself. If you are buying for only video call to mother or grand parents , then it's ok. I bought and it's not able to connect to any wifi in two days.",1,android go dont go buying buying video call mother grand parents ok bought able connect wifi two days,0.5,0.7083333333333334,218,Positive
"realme Narzo 50i (Mint Green, 32 GB)  (2 GB RAM)",Don't purchase this smartphone 👎,1,dont purchase smartphone,0.0,0.0,32,Neutral
"realme Narzo 50i (Mint Green, 32 GB)  (2 GB RAM)",Loss off money,1,loss money,0.0,0.0,14,Neutral
"realme Narzo 30 (Racing Blue, 128 GB)  (6 GB RAM)","Such a awesome handset in this segment.Pro's:- * Good display in this price segment but not compete with amoled display.* Helio G95 performs pretty well ,with 90 hz refresh rate runs smoothly.* 48 Mp rear sensor satisfies in this price segment, etcCon's :- * After 1 hour of gaming I found touch issues and some lags ,hope realme fix it in update* There is no IP rate certification I think so.* There are lot of heating issues , etc",4,awesome handset segmentpros display price segment compete amoled display helio g performs pretty well hz refresh rate runs smoothly mp rear sensor satisfies price segment etccons hour gaming found touch issues lags hope realme fix update ip rate certification think lot heating issues etc,0.5499999999999999,0.8333333333333334,432,Positive
"realme Narzo 30 (Racing Blue, 128 GB)  (6 GB RAM)","Nice phone great look, in this range camera quality little bit more better like 64mega pixel or use sony or samsung lens, in this range many brands giving 64 mega pixel. & It's 4g mobile.",5,look range camera quality little bit better like mega pixel use sony samsung lens range many brands giving mega pixel g,0.2708333333333333,0.5,187,Positive
